{"contract_version":"patent-research.v2","artifact_type":"LabelDecisionSet","corpus_id":"sha256:0000000000000000000000000000000000000000000000000000000000000000","evidence_records":[{"evidence_id":"sha256:1111111111111111111111111111111111111111111111111111111111111111","corpus_id":"sha256:0000000000000000000000000000000000000000000000000000000000000000","pn":"CN1A","field":"claims","locator":"D114:CN1A:claims:chars:0-30","text_hash":"2222222222222222222222222222222222222222222222222222222222222222","truncated":false}],"decisions":[{"pn":"CN1A","dimension":"fuel","value":"hydrogen","state":"supported","confidence":"high","evidence_ids":["sha256:1111111111111111111111111111111111111111111111111111111111111111"],"rationale":"Claim text directly identifies hydrogen."}],"conflicts":[],"search_gap_requests":[]}
